{
  "$schema": "https://json-schema.org/draft/2020-12/schema",
  "$id": "https://github.com/redballoom/rpa-dev-template/schemas/input.schema.json",
  "title": "ShadowBot RPA Input",
  "type": "object",
  "required": [
    "schema_version",
    "project",
    "tasks"
  ],
  "properties": {
    "schema_version": {
      "type": "string",
      "const": "1.0"
    },
    "project": {
      "type": "string",
      "minLength": 1
    },
    "tasks": {
      "type": "array",
      "minItems": 1,
      "items": {
        "type": "object",
        "required": [
          "id",
          "name",
          "type",
          "payload"
        ],
        "properties": {
          "id": {
            "oneOf": [
              {"type": "string"},
              {"type": "integer"}
            ]
          },
          "name": {
            "type": "string",
            "minLength": 1
          },
          "type": {
            "type": "string",
            "minLength": 1
          },
          "payload": {
            "type": "object"
          },
          "continue_on_error": {
            "type": "boolean"
          }
        },
        "additionalProperties": true
      }
    },
    "context": {
      "type": "object",
      "properties": {
        "operator": {
          "type": "string"
        },
        "env": {
          "type": "string",
          "enum": [
            "local",
            "dev",
            "test",
            "staging",
            "prod",
            "production"
          ]
        },
        "source": {
          "type": "string"
        },
        "app_name": {
          "type": "string"
        },
        "account_name": {
          "type": "string"
        },
        "trigger_mode": {
          "type": "string",
          "enum": [
            "dev",
            "manual",
            "schedule",
            "assistant"
          ]
        },
        "repo_path": {
          "type": "string"
        },
        "fail_fast": {
          "type": "boolean"
        }
      },
      "additionalProperties": true
    }
  },
  "additionalProperties": true
}
