{
  "schema_version": "1.0",
  "project": "示例项目",
  "tasks": [
    {
      "id": -1,
      "name": "校验订单金额",
      "type": "template_demo",
      "payload": {
        "file_path": "data/orders_warning.xlsx",
        "shop_id": "S001"
      }
    }
  ],
  "context": {
    "operator": "yingdao",
    "env": "prod",
    "source": "yingdao",
    "app_name": "示例项目"
  }
}
